Название;Ветка навыка;Тип;Стоимость;Требования;Действие
Истинная скрытность 4;Плут;О;10 L;Истинная скрытность 3;Вы скрытны для всех существ не выше 14-ого уровня и героев с навыком «Истинная скрытность 2». Вас с трудом находят герои с навыком «Истинная скрытность 3».
Истинная скрытность 5;Плут;О;15 L;Истинная скрытность 4;Вы скрытны для всех существ не выше 15-ого уровня и героев с навыком «Истинная скрытность 3». Вас с трудом находят герои с навыком «Истинная скрытность 4».
Сопротивление плута 1;Плут;О;1 L;При наличии траты всех очков в не Древней плутовской ветке;Вы получаете возможность использовать плутовское оружие как щит, правда, с меньшей эффективностью.
Сопротивление плута 2;Плут;О;3 L;Сопротивление плута 1;Вы получаете несколько меньше урона от всех источников, пока находитесь в Скрытности.
Сопротивление плута 3;Плут;О;6 L;Сопротивление плута 2;Вы получаете сопротивление к ударам из засады.
Сопротивление плута 4;Плут;О;10 L;Сопротивление плута 3;Вы получаете меньше урона от всех зачарований и эффектов оружия.
Сопротивление плута 5;Плут;О;15 L;Сопротивление плута 4;Вы получаете значительно меньше урона от всех источников, пока находитесь в Скрытности.
Недоверие технарям;Плут;Д;--;Сопротивление плута 1;Вы получаете меньше урона от технарей и кудесников.
Атака из засады;Плут;Д;--;Истинная скрытность 2, Сопротивление плута 2;В момент нанесения удара в скрытности, вы наносите гораздо более сильный урон. После удара с небольшим шансом броня соперника может серьезно повредиться.
Находчивый зельевар;Плут;Д;--;Мастер зельеварения 3, Сопротивление плута 2;Вы можете не использовать любой компонент при варке зелья, если он не единственный.
Фантастическая ловкость;Плут;Д;--;Истинная скрытность 3, Сопротивление плута 2;Вы получаете фантастическую ловкость, а также увеличиваете свою скорость и реакцию.
Смертельный удар;Плут;Д;--;Истинная скрытность 3, Сопротивление плута 3;В момент нанесения удара в скрытности, вы наносите колоссальный урон, игнорируя все, кроме Древних заклинаний и брони. После удара с некоторым шансом броня соперника может серьезно повредиться.
Скрытный ниндзя;Плут;Д;--;Истинная скрытность 4;Пока вы находитесь в скрытности, на вас не действуют не Древние заклинания и барьеры.
Всезрение;Плут;Д;--;Мастер зельеварения 5, Истинная скрытность 4, Сопротивление плута 3;Вы получаете возможность видеть абсолютно все характеристики любого объекта.
